date,rain,uv,astronomical,date,temp_max,temp_min,extended_text,icon_descriptor,short_text,fire_danger,now
2020-10-19T13:00:00Z,"{'amount': {'min': 0, 'max': None, 'units': 'mm'}, 'chance': 5}","{'category': 'high', 'end_time': '2020-10-20T05:20:00Z', 'max_index': 7, 'start_time': '2020-10-19T22:40:00Z'}","{'sunrise_time': '2020-10-19T19:29:18Z', 'sunset_time': '2020-10-20T08:43:00Z'}",2020-10-19T13:00:00Z,17,7,Mostly sunny. The chance of fog early this morning. Light winds becoming southeast to southwesterly 15 to 25 km/h in the afternoon then becoming light in the late evening.,mostly_sunny,Mostly sunny.,Low-Moderate,"{'is_night': False, 'now_label': 'Max', 'later_label': 'Overnight Min', 'temp_now': 17, 'temp_later': 10}"
2020-10-20T13:00:00Z,"{'amount': {'min': 0, 'max': None, 'units': 'mm'}, 'chance': 10}","{'category': 'high', 'end_time': '2020-10-21T05:20:00Z', 'max_index': 7, 'start_time': '2020-10-20T22:50:00Z'}","{'sunrise_time': '2020-10-20T19:27:59Z', 'sunset_time': '2020-10-21T08:44:00Z'}",2020-10-20T13:00:00Z,19,10,Partly cloudy. Areas of fog in the early morning. Slight (20%) chance of a shower in the northwest suburbs. Light winds becoming southerly 15 to 25 km/h in the early afternoon then becoming light in the late evening.,fog,Partly cloudy. Local early fog.,Low-Moderate,
2020-10-21T13:00:00Z,"{'amount': {'min': 0, 'max': 0.4, 'units': 'mm'}, 'chance': 30}","{'category': 'high', 'end_time': '2020-10-22T05:20:00Z', 'max_index': 7, 'start_time': '2020-10-21T22:40:00Z'}","{'sunrise_time': '2020-10-21T19:26:40Z', 'sunset_time': '2020-10-22T08:45:01Z'}",2020-10-21T13:00:00Z,19,11,"Partly cloudy. The chance of morning fog. Slight (30%) chance of a shower, most likely in the afternoon and evening. Light winds becoming southerly 15 to 20 km/h during the afternoon then becoming light during the evening.",mostly_sunny,Partly cloudy.,Low-Moderate,
2020-10-22T13:00:00Z,"{'amount': {'min': 0, 'max': 10, 'units': 'mm'}, 'chance': 50}","{'category': 'veryhigh', 'end_time': '2020-10-23T05:30:00Z', 'max_index': 8, 'start_time': '2020-10-22T22:40:00Z'}","{'sunrise_time': '2020-10-22T19:25:22Z', 'sunset_time': '2020-10-23T08:46:02Z'}",2020-10-22T13:00:00Z,20,11,"Cloudy. The chance of morning fog in the northeast suburbs. Medium (50%) chance of showers, most likely in the afternoon and evening. Light winds.",shower,Shower or two.,Low-Moderate,
2020-10-23T13:00:00Z,"{'amount': {'min': 0, 'max': 4, 'units': 'mm'}, 'chance': 60}","{'category': None, 'end_time': None, 'max_index': None, 'start_time': None}","{'sunrise_time': '2020-10-23T19:24:05Z', 'sunset_time': '2020-10-24T08:47:03Z'}",2020-10-23T13:00:00Z,16,12,"Cloudy. Medium (60%) chance of showers, most likely during the morning. Winds southerly 20 to 30 km/h.",shower,Shower or two.,,
2020-10-24T13:00:00Z,"{'amount': {'min': 0, 'max': 1, 'units': 'mm'}, 'chance': 50}","{'category': None, 'end_time': None, 'max_index': None, 'start_time': None}","{'sunrise_time': '2020-10-24T19:22:50Z', 'sunset_time': '2020-10-25T08:48:05Z'}",2020-10-24T13:00:00Z,15,10,Cloudy. Medium (50%) chance of showers. Winds south to southwesterly 15 to 25 km/h tending south to southeasterly 25 to 35 km/h during the morning.,shower,Shower or two.,,
2020-10-25T13:00:00Z,"{'amount': {'min': 0, 'max': 0.4, 'units': 'mm'}, 'chance': 40}","{'category': None, 'end_time': None, 'max_index': None, 'start_time': None}","{'sunrise_time': '2020-10-25T19:21:35Z', 'sunset_time': '2020-10-26T08:49:07Z'}",2020-10-25T13:00:00Z,16,9,Cloudy. Medium (40%) chance of showers. Winds southeasterly 20 to 30 km/h.,shower,Possible shower.,,
